{
  "schemaVersion": "1.0",
  "id": "ev_9b1d4c7e2a6f48d3a05c7e1b9d2f4a68",
  "type": "secret.tested",
  "source": "vault",
  "tenantId": "tn_demo0001",
  "time": "2026-10-31T09:15:00Z",
  "actor": { "userId": "us_demo0001" },
  "data": {
    "secretId": "0191a2b3-c4d5-7e6f-8a9b-0c1d2e3f4a5b",
    "kind": "anthropic_api_key",
    "label": "Firm Claude key",
    "lastFour": "1234",
    "result": "passed"
  }
}
